"label","type","accession","title","author","year","journal","volume","issue","keywords","publisher","issn","pages","abstract","address","eppi_id","doi","institution","url","journal_secondary","edition","db","editor","dp","id","n1","u2","l3","filename","n_duplicates","screened_abstracts","notes"
"Giletta_2013_JRA","JOUR","2013-30037-005","Direct and indirect peer socialization of adolescent nonsuicidal selfinjury","Giletta, Matteo and Burk, William J. and Scholte, Ron H. J. and Engels, Rutger C. M. E. and Prinstein, Mitchell J.","2013","J Res Adolesc","23","3","peer socialization and adolescent friendship and self injury and depressive symptoms and suicidal forms and Adolescent Psychology and Friendship and Peer Relations and Socialization and Suicidal Ideation and Major Depression and Peers and Symptoms","Wiley-Blackwell Publishing Ltd.","1050-8392 and 1532-7795","450-463","This study examined direct and indirect forms of peer socialization of nonsuicidal selfinjury (NSSI) in adolescent friendship networks. Data were collected among 348 adolescents (55% females; Mage = 15.02 years; SD = 0.53) at four assessment waves. Stochastic actorbased models revealed no evidence for direct socialization of NSSI: adolescents whose friends reported higher NSSI did not increase their NSSI over time. However, indirect forms of socialization were found. After controlling for direct socialization and selection effects, friends' depressive symptoms predicted changes in male and female adolescents' NSSI, and friends' impulsivity predicted changes in male adolescents' NSSI. Findings highlight the importance of extending peer influence research beyond the classical 'modeling' paradigm by providing evidence that peers may indirectly socialize adolescents' NSSI. (PsycINFO Database Record (c) 2016 APA, all rights reserved)","Giletta, Matteo, Department of Psychology, University of North Carolina at Chapel Hill, Davie Hall, Campus Box 3270, Chapel Hill, NC, US, 27599","Sponsor: National Institutes of Health, US. Grant: R01-MH85505; R01-HD055342. Recipients: Prinstein, Mitchell J.","10.1111/jora.12036",NA,"http://search.ebscohost.com/login.aspx?direct=true&AuthType=ip,uid&db=psyh&AN=2013-30037-005&site=ehost-live&scope=site and giletta@live.unc.edu","Journal of Research on Adolescence",NA,"psyh",NA,"EBSCOhost","2013-30037-005","Accession Number: 2013-30037-005. PMID: 26412955 Partial author list: First Author & Affiliation: Giletta, Matteo; University of North Carolina at Chapel Hill, Chapel Hill, NC, US. Other Publishers: Blackwell Publishing. Release Date: 20131209. Publication Type: Journal (0100), Peer Reviewed Journal (0110). Format Covered: Electronic. Document Type: Journal Article. Language: English. Grant Information: Prinstein, Mitchell J. Major Descriptor: Adolescent Psychology; Friendship; Peer Relations; Socialization; Suicidal Ideation. Minor Descriptor: Major Depression; Peers; Symptoms. Classification: Psychosocial & Personality Development (2840). Population: Human (10); Male (30); Female (40). Location: US. Age Group: Adolescence (13-17 yrs) (200); Adulthood (18 yrs & older) (300); Young Adulthood (18-29 yrs) (320). Tests & Measures: Mood and Feeling Questionnaire; Nonsuicidal Self Injury Measure; Friendship Nominations Measure; Barratt Impulsiveness Scale-11 DOI: 10.1037/t05661-000. Methodology: Empirical Study; Longitudinal Study; Quantitative Study. References Available: Y. Page Count: 14. Issue Publication Date: Sep, 2013. Copyright Statement: The Authors. Journal of Research on AdolescenceSociety for Research on Adolescence. 2013.",NA,NA,"Problem sets/PS 2/PsycINFO.ris",1,"excluded","Discusses peer influence on self-injury, which can be a related issue but not specifically focused on bullying or suicide."
"Ahmadi.Montecalvo_2019_AJHB","JOUR",NA,"A Latent Class Analysis of the Co-occurrence of Risk Behaviors among Adolescents","Ahmadi-Montecalvo, Halima and Lilly, Christa L. and Zullig, Keith J. and Jarrett, Traci and Cottrell, Lesley A. and Dino, Geri A.","2019","AM J HEALTH BEHAV","43","3","Risk Taking Behavior -- Evaluation -- In Adolescence and Sex Factors and Latent Structure Analysis and Human and United States and Female and Male and Adolescence and Probability and Cluster Sample and Students, High School and Sample Size and Substance Abuse and Methylenedioxymethamphetamine and Suicidal Ideation and Depression and Suicide, Attempted and Bullying and Obesity and Driving While Intoxicated and Distracted Driving and Life Style, Sedentary and Descriptive Statistics and Data Analysis Software and Eating Behavior","PNG Publications","1087-3244","449-463","Objectives: In this study, we examined the co-occurrence of multiple health-risk behaviors to determine whether there are any differences in the pattern of co-occurrence by sex. Methods: We conducted latent class analysis using the national 2013 Youth Risk Behavior Survey data for the overall sample, and separately by sex (N = 13,583). Results: Over half of the sample (53%) belonged to the low risk subgroup (Class 1). Class 2 accounted for 15% of adolescents, and over 40% in this subgroup reported riding with a drunk driver, and 63% reported texting while driving a vehicle. Over 14% belonged to Class 3, which had a higher probability of being depressed and suicidal (81% and 64%, respectively). Class 4 accounted for over 9% of adolescents who reported high probabilities for current cigarette (97%), tobacco (99%), and alcohol use (73%); and over half reported current marijuana use (52%). Class 5 accounted for 8.5% of adolescents identified as high-risk polysubstance users. Analyses showed differences by sex in the pattern of co-occurrences. Conclusion: Several adolescent risk behaviors are interrelated regardless of sex. However, sex differences in the higher probability of depressive symptoms and suicidality among girls highlight the need for interventions that consider the demographic composition of adolescents.","Senior Research Scientist, Sigma Health Consulting, LLC, Research and Evaluation, McLean and Assistant Professor, West Virginia University School of Public Health, Department of Biostatistics and Chair and Professor, West Virginia University School of Public Health, Department of Social and Behavioral Sciences and Research Assistant Professor, West Virginia University School of Public Health, Department of Social and Behavioral Sciences and Professor, West Virginia University School of Medicine, Department of Pediatrics and Professor, West Virginia University School of Public Health, Department of Social and Behavioral Sciences",NA,"10.5993/AJHB.43.3.1","Oak Ridge, North Carolina","http://search.ebscohost.com/login.aspx?direct=true&AuthType=ip,uid&db=rzh&AN=136145971&site=ehost-live&scope=site","American Journal of Health Behavior",NA,"rzh",NA,"EBSCOhost","136145971","Accession Number: 136145971. Language: English. Entry Date: 20190503. Revision Date: 20190503. Publication Type: Article; research; tables/charts. Journal Subset: Blind Peer Reviewed; Double Blind Peer Reviewed; Expert Peer Reviewed; Health Promotion/Education; Peer Reviewed; USA. NLM UID: 9602338.",NA,NA,"Problem sets/PS 2/CINAHL.ris",1,"excluded",""
"Peltzer_2017_IJPCP.1","JOUR","2017-43254-007","Suicidal ideation and associated factors among students aged 1315 years in Association of Southeast Asian Nations (ASEAN) member states, 20072013","Peltzer, Karl and Pengpid, Supa","2017","Int J Psychiatry Clin Pract","21","3","Suicidal ideation and factors and psychological and stress and social environment and Southeast Asia and Social Environments and Stress and Suicidal Ideation and Southeast Asian Cultural Groups","Taylor & Francis","1365-1501 and 1471-1788","201-208","Objective: The aim of this study was to assess suicidal ideation and associated factors in school-going adolescents in the Association of Southeast Asian Nations (ASEAN) member states. Methods: The analysis included 30,284 school children aged 1315 years from seven ASEAN countries that participated in the cross-sectional global school-based student health survey (GSHS) between 2007 and 2013. Results: The overall prevalence of suicidal ideation in the past 12 months across seven ASEAN countries was 12.3%, significantly higher in girls (15.1%) than boys (9.3%). Among seven ASEAN countries with the highest prevalence of suicidal ideation was in the Philippines (17.0%) and Vietnam (16.9%) and the lowest in Myanmar (1.1%) and Indonesia (4.2%). In multivariable logistic regression analysis, female gender, older age (14 or 15 years), living in a lower middle income country, having no friends, loneliness, bullying victimisation, having been in a physical fight in the past 12 months, lack of parental or guardian support, tobacco use and having a history of ever got drunk were associated with suicidal ideation. Conclusions: Different rates of suicidal ideation were observed in ASEAN member states. Several risk factors for suicidal ideation were identified which can help guide preventive efforts. (PsycINFO Database Record (c) 2017 APA, all rights reserved)","Peltzer, Karl, ASEAN Institute for Health Development, Mahidol University, 25/25 Phutthamonthon 4 Rd., Salaya, Phutthamonthon, Nakhon Pathom, Thailand, 73170",NA,"10.1080/13651501.2017.1301486",NA,"http://search.ebscohost.com/login.aspx?direct=true&AuthType=ip,uid&db=psyh&AN=2017-43254-007&site=ehost-live&scope=site and karl.pel@mahidol.ac.th","International Journal of Psychiatry in Clinical Practice",NA,"psyh",NA,"EBSCOhost","2017-43254-007","Accession Number: 2017-43254-007. PMID: 28318361 Partial author list: First Author & Affiliation: Peltzer, Karl; ASEAN Institute for Health Development, Mahidol University, Nakhon Pathom, Thailand. Other Publishers: Informa Healthcare. Release Date: 20171113. Publication Type: Journal (0100), Peer Reviewed Journal (0110). Format Covered: Electronic. Document Type: Journal Article. Language: English. Major Descriptor: Social Environments; Stress; Suicidal Ideation. Minor Descriptor: Southeast Asian Cultural Groups. Classification: Behavior Disorders & Antisocial Behavior (3230). Population: Human (10); Male (30); Female (40). Location: South Africa. Age Group: Adolescence (13-17 yrs) (200). Methodology: Empirical Study; Quantitative Study. Page Count: 8. Issue Publication Date: Jul, 2017. Publication History: Accepted Date: Feb 16, 2017; Revised Date: Feb 1, 2017; First Submitted Date: Dec 1, 2016. Copyright Statement: Informa UK Limited, trading as Taylor & Francis Group. 2017.",NA,NA,"Problem sets/PS 2/PsycINFO.ris",2,"selected","Examines suicidal ideation and its factors, including bullying, in adolescents, relevant to this topic."
"Saleh_2014_AdsebeinthdiagCofocllepraned","CHAP","2014-12900-007","Cybersexual harassment and suicide","Saleh, Fabian M. and Feldman, Barry N. and Grudzinskas, Albert J. Jr. and Ravven, Simha E. and Cody, Richard","2014","Adolescent sexual behavior in the digital age: Considerations for clinicians, legal professionals, and educators",NA,NA,"cybersexual harassment and suicide and media coverage and social concern and bullying and cyberbullying and Harassment and Internet and Suicide and Bullying and Computer Mediated Communication and Mass Media","Oxford University Press","978-0-19-994559-7","139-160","In this chapter we will explore the developmental underpinnings of traditional bullying and the more contemporary manifestations of this phenomenon in cyberbullying. We suggest that the emergence of cyber-bullying and media coverage that linked this form of bullying with the suicide of individual youths fostered renewed social concern in the topic, which has in turn spearheaded novel legal responses. These processes have occurred, however, when research on cyber-bullying remains in its early stages and thus in response to aspects of the digital revolution that remain poorly understood. We aim to critically evaluate extant empirical data about the relationship between bullying and an increased risk for suicidal behavior. We will review various legislative responses to bullying that have largely resulted from how the digital revolution configures the phenomenon of bullying. In this discussion we will consider the congruence between developmental research on bullying and emerging legal interventions. We conclude with a synthesis that includes implications for stake-holding professionals who work with youth. (PsycInfo Database Record (c) 2020 APA, all rights reserved)",NA,NA,"10.1093/med/9780199945597.003.0007","New York, NY","http://search.ebscohost.com/login.aspx?direct=true&AuthType=ip,uid&db=psyh&AN=2014-12900-007&site=ehost-live&scope=site",NA,"Saleh, Fabian M. and Grudzinskas, Albert Jr. and Judge, Abigail","psyh","Saleh, Fabian M. and Grudzinskas, Albert Jr. and Judge, Abigail","EBSCOhost","2014-12900-007","Accession Number: 2014-12900-007. Partial author list: First Author & Affiliation: Saleh, Fabian M.; Harvard Medical School, Boston, MA, US. Release Date: 20140825. Correction Date: 20200713. Publication Type: Book (0200), Edited Book (0280). Format Covered: Print. Document Type: Chapter. ISBN: 978-0-19-994559-7, Hardcover. Language: English. Major Descriptor: Harassment; Internet; Suicide; Bullying; Computer Mediated Communication. Minor Descriptor: Mass Media. Classification: Behavior Disorders & Antisocial Behavior (3230). Population: Human (10). Age Group: Childhood (birth-12 yrs) (100); Adolescence (13-17 yrs) (200); Adulthood (18 yrs & older) (300). Intended Audience: Psychology: Professional & Research (PS). Tests & Measures: Second Youth Internet Safety Survey. References Available: Y. Page Count: 22.",NA,NA,"Problem sets/PS 2/PsycINFO.ris",1,"selected",""
"Hong_2015_TrauViolAbus","JOUR","2015-40607-001","Pathways from bullying perpetration, victimization, and bully victimization to suicidality among school-aged youth: A review of the potential mediators and a call for further investigation","Hong, Jun Sung and Kral, Michael J. and Sterzing, Paul R.","2015","Trauma Violence Abuse","16","4","bullying and children and adolescents and mental health and suicide and youth violence and Adolescent and Adolescent Behavior and Adolescent Psychiatry and Bullying and Crime Victims and Female and Humans and Male and Peer Group and Students and Substance-Related Disorders and Suicide and Schools and Students and Suicide and Victimization and Bullying and Public Health and Suicidality","Sage Publications","1524-8380 and 1552-8324","379-390","In the wake of several highly publicized adolescent suicides attributed to bullying victimization, national attention has been brought to bear on the profound public health problem of bullying. This article reviews the extant literature on the associations between bullying perpetration, victimization, and thoughts of or attempts at suicide and proposes five potential mediators, namely depression, anxiety, low self-esteem, loneliness, and hopelessness, that may explain this relationship. Numerous studies have found empirical support for the interrelations between internalizing behaviors and both bullying perpetration and victimization and suicide. We find that further longitudinal research needs to be conducted to more conclusively determine the role and causal ordering these various psychosocial factors may play in bullying perpetration, victimization, and suicide. Although the research literature implies causal directions among all these potential mediators, untangling the unique influence of bullying perpetration, victimization, and bully victimization on suicide and its mechanisms of action has major research and practice implications. (PsycInfo Database Record (c) 2020 APA, all rights reserved)","Hong, Jun Sung, School of Social Work, Wayne State University, 4756 Cass Avenue, Detroit, MI, US, 48202",NA,"10.1177/1524838014537904",NA,"http://search.ebscohost.com/login.aspx?direct=true&AuthType=ip,uid&db=psyh&AN=2015-40607-001&site=ehost-live&scope=site and fl4684@wayne.edu","Trauma, Violence, & Abuse",NA,"psyh",NA,"EBSCOhost","2015-40607-001","Accession Number: 2015-40607-001. PMID: 24903399 Partial author list: First Author & Affiliation: Hong, Jun Sung; School of Social Work, Wayne State University, Detroit, MI, US. Release Date: 20160418. Correction Date: 20200903. Publication Type: Journal (0100), Peer Reviewed Journal (0110). Format Covered: Electronic. Document Type: Journal Article. Language: English. Major Descriptor: Schools; Students; Suicide; Victimization; Bullying. Minor Descriptor: Public Health; Suicidality. Classification: Behavior Disorders & Antisocial Behavior (3230). Population: Human (10). Age Group: Childhood (birth-12 yrs) (100); School Age (6-12 yrs) (180). Tests & Measures: Rosenberg Self-Esteem Scale DOI: 10.1037/t01038-000. References Available: Y. Page Count: 12. Issue Publication Date: Oct, 2015. Copyright Statement: The Author(s). 2014.",NA,NA,"Problem sets/PS 2/PsycINFO.ris",2,"selected","Discusses bullying, suicidality, and mental health issues, relevant to adolescent suicidality and bullying."
"Kishi_2016_SchiBull","JOUR","2016-57048-018","Mortality risk associated with long-acting injectable antipsychotics: A systematic review and meta-analyses of randomized controlled trials","Kishi, Taro and Matsunaga, Shinji and Iwata, Nakao","2016","Schizophr Bull","42","6","long-acting injectable antipsychotics and mortality and schizophrenia and meta-analysis and systematic review and Antipsychotic Agents and Delayed-Action Preparations and Humans and Randomized Controlled Trials as Topic and Schizophrenia and Death and Dying and Drug Administration Methods and Neuroleptic Drugs and Schizophrenia and Mortality Risk","Oxford University Press","0586-7614 and 1745-1701","1438-1445","Long-acting injectable (LAI) antipsychotics (LAI-APs) have several advantages over oral medications, but deaths reported in Japan during the early post-marketing phase vigilance period have raised safety concerns. We conducted a series of meta-analyses to assess whether LAI-APs affect the mortality of patients with schizophrenia. Three categorical meta-analyses of randomized controlled trials (RCTs) were performed to compare all-cause death (primary outcome) and death due to suicide: individual and pooled LAI-APs vs placebo, individual and pooled LAI-APs vs oral antipsychotics (OAPs), and head-to-head comparisons of LAI-APs. The risk ratios (RRs) and 95% CIs were calculated. We identified 52 RCTs (53 comparisons; total participants = 17 416, LAI-APs = 11 360, OAP = 3910, and placebo = 2146; mean study duration [wk]: LAI-APs vs placebo = 28.9, LAI-APs vs OAPs = 64.5). Neither pooled nor individual LAI-APs (aripiprazole, fluphenazine, olanzapine, paliperidone, and risperidone) differed from the placebo regarding the incidences of all-cause death (pooled LAI-APs: RR = 0.64, P = .37) and death due to suicide (pooled LAI-APs: RR = 0.98, P = .98). However, in a subgroup meta-analysis of only short-duration RCTs (13 wk), pooled LAI-APs exhibited a trend toward lower incidence of all-cause death than placebo (RR = 0.29, P = .08). Pooled LAI-APs (aripiprazole, fluphenazine, haloperidol, olanzapine, paliperidone, risperidone, and zuclopenthixol) did not differ from pooled OAPs regarding all-cause death (pooled LAI-APs: RR = 0.71, P = .30) and death due to suicide (pooled LAI-APs: RR = 0.94, P = .91). Individual LAI-APs and OAPs were associated with similar risks of death. Data for head-to-head comparisons of individual LAI-APs were insufficient. In conclusion, there was no significant difference between LAI-APs and placebo or OAPs regarding all-cause death and death due to suicide. (PsycINFO Database Record (c) 2019 APA, all rights reserved)","Kishi, Taro, Department of Psychiatry, Fujita Health University, School of Medicine, Aichi, Toyoake, Japan, 470-1192",NA,"10.1093/schbul/sbw043",NA,"http://search.ebscohost.com/login.aspx?direct=true&AuthType=ip,uid&db=psyh&AN=2016-57048-018&site=ehost-live&scope=site and tarok@fujita-hu.ac.jp","Schizophrenia Bulletin",NA,"psyh",NA,"EBSCOhost","2016-57048-018","Accession Number: 2016-57048-018. PMID: 27086079 Partial author list: First Author & Affiliation: Kishi, Taro; Department of Psychiatry, Fujita Health University, School of Medicine, Toyoake, Japan. Other Publishers: National Institute of Mental Health. Release Date: 20170209. Correction Date: 20190211. Publication Type: Journal (0100), Peer Reviewed Journal (0110). Format Covered: Electronic. Document Type: Journal Article. Language: English. Major Descriptor: Death and Dying; Drug Administration Methods; Neuroleptic Drugs; Schizophrenia; Mortality Risk. Classification: Schizophrenia & Psychotic States (3213); Clinical Psychopharmacology (3340). Population: Human (10). Methodology: Literature Review; Systematic Review; Meta Analysis. Page Count: 8. Issue Publication Date: Nov, 2016. Publication History: First Posted Date: Apr 16, 2016. Copyright Statement: Published by Oxford University Press on behalf of the Maryland Psychiatric Research Center. All rights reserved. The Author. 2016.",NA,NA,"Problem sets/PS 2/PsycINFO.ris",1,"excluded","Focuses on medication and schizophrenia treatment, not relevant to this research on bullying and suicidality."
"Rivara_2019_HEAAFF","JOUR",NA,"The Effects Of Violence On Health","Rivara, Frederick and Adhia, Avanti and Lyons, Vivian and Massey, Anne and Mills, Brianna and Morgan, Erin and Simckes, Maayan and Rowhani-Rahbar, Ali","2019","HEALTH AFF","38","10","Violence -- Complications and Victims -- Psychosocial Factors and Health Status and Child Abuse -- Epidemiology and Child Abuse -- Complications and Intimate Partner Violence -- Epidemiology and Intimate Partner Violence -- Complications and Elder Abuse -- Epidemiology and Elder Abuse -- Complications and Sexual Abuse -- Epidemiology and Sexual Abuse -- Complications and Bullying -- Epidemiology and Bullying -- Complications and Depression -- Risk Factors and Anxiety -- Risk Factors and Stress Disorders, Post-Traumatic -- Risk Factors and Suicide -- Risk Factors and Cardiovascular Risk Factors and Violence -- Mortality and Age Factors and Sex Factors","Project HOPE/HEALTH AFFAIRS","0278-2715","1622-1629","Violence in its many forms can affect the health of people who are the targets, those who are the perpetrators, and the communities in which both live. In this article we review the literature on the health consequences of many forms of violence, including child physical and sexual abuse, intimate partner violence, elder abuse, sexual violence, youth violence, and bullying. The biological effects of violence have become increasingly better understood and include effects on the brain, neuroendocrine system, and immune response. Consequences include increased incidences of depression, anxiety, posttraumatic stress disorder, and suicide; increased risk of cardiovascular disease; and premature mortality. The health consequences of violence vary with the age and sex of the victim as well as the form of violence. People can be the victims of multiple forms of violence, and the health effects can be cumulative.","Seattle Children's Guild Endowed Chair in Pediatric Research and Professor in the Department of Pediatrics at the University of Washington, in Seattle and Senior fellow in the Department of Pediatrics, University of Washington and Doctoral candidate in the Department of Epidemiology, University of Washington and Research scientist in the Harborview Injury Prevention and Research Center, University of Washington and Bartley Dobb Professor for the Study of Violence and an associate professor in the Department of Epidemiology, University of Washington",NA,"10.1377/hlthaff.2019.00480","Bethesda, Maryland","http://search.ebscohost.com/login.aspx?direct=true&AuthType=ip,uid&db=rzh&AN=138944563&site=ehost-live&scope=site","Health Affairs",NA,"rzh",NA,"EBSCOhost","138944563","Accession Number: 138944563. Language: English. Entry Date: 20191007. Revision Date: 20191009. Publication Type: Article; review. Journal Subset: Health Services Administration; Peer Reviewed; USA. NLM UID: 8303128.",NA,NA,"Problem sets/PS 2/CINAHL.ris",1,"excluded",""
