"label","type","accession","title","author","year","journal","volume","issue","keywords","publisher","issn","pages","abstract","address","eppi_id","doi","institution","url","journal_secondary","edition","db","editor","dp","id","n1","u2","l3","filename","n_duplicates","screened_abstracts","notes"
"Airuehia_2014_PsyAnn","JOUR","2014-44513-002","Suicidality and melancholia in a 17-year-old girl","Airuehia, Efosa and Adam, Balkozar","2014","Psychiatr Ann","44","8","suicidality and melancholia and major depression and cyber bullying and Major Depression and Suicidal Ideation and Cyberbullying and Suicidality","SLACK","0048-5713 and 1938-2456","363-364","Presents a report of a 17-year old girl who was brought to the emergency department by her mother after expressing a desire to kill herself. She also expressed a 1-year history of low mood with associated loss of pleasure, early morning awakening, poor concentration, low energy levels, and feeling sluggish. She was not following up with a psychiatrist or counselor and had not been previously admitted to an inpatient psychiatric unit. Her symptomatology clearly met criteria for a major depressive episode. She also met criteria for the melancholic features specifier, as she had loss of pleasure in almost all activities and a lack of reactivity to usually pleasurable stimuli. After being admitted to the inpatient unit, a biopsychosocial approach to her management was instituted which included antidepressant therapy, group and individual psychotherapy, and parental discussions to eliminate ongoing cyber bullying. The patient improved and remains stable, and every effort was made to directly ascertain the possibility of bullying and follow through to ensure it is terminated. It is important to increase awareness of cyber bullying among mental health professionals as well as school staff and parents. (PsycINFO Database Record (c) 2019 APA, all rights reserved)","Airuehia, Efosa, Pathways Behavioral Health, 601 Business Loop 70 W, Columbia, MO, US, 65203",NA,"10.3928/00485713-20140806-02",NA,"http://search.ebscohost.com/login.aspx?direct=true&AuthType=ip,uid&db=psyh&AN=2014-44513-002&site=ehost-live&scope=site and air4osa@yahoo.com","Psychiatric Annals",NA,"psyh",NA,"EBSCOhost","2014-44513-002","Accession Number: 2014-44513-002. Partial author list: First Author & Affiliation: Airuehia, Efosa; Pathways Behavioral Health, Columbia, MO, US. Release Date: 20141201. Correction Date: 20190211. Publication Type: Journal (0100), Peer Reviewed Journal (0110). Format Covered: Electronic. Document Type: Journal Article. Language: English. Major Descriptor: Major Depression; Suicidal Ideation; Cyberbullying; Suicidality. Classification: Psychological Disorders (3210). Population: Human (10); Female (40); Inpatient (50). Age Group: Adolescence (13-17 yrs) (200). References Available: Y. Page Count: 2. Issue Publication Date: Aug, 2014. Copyright Statement: SLACK Incorporated",NA,NA,"Problem sets/PS 2/PsycINFO.ris",1,"selected",""
"Meininger_2017_LancNeur","JOUR","2017-08653-022","Safety and efficacy of ozanezumab in patients with amyotrophic lateral sclerosis: A randomised, double-blind, placebo-controlled, phase 2 trial","Meininger, Vincent and Genge, Angela and van den Berg, Leonard H. and Robberecht, Wim and Ludolph, Albert and Chio, Adriano and Kim, Seung H. and Leigh, P. Nigel and Kiernan, Matthew C. and Shefner, Jeremy M. and Desnuelle, Claude and Morrison, Karen E. and Petri, Susanne and Boswell, Diane and Temple, Jane and Mohindra, Rajat and Davies, Matt and Bullman, Jonathan and Rees, Paul and Lavrov, Arseniy","2017","Lancet Neurol","16","3","durg safety and ozanezumab and amyotrophic lateral sclerosis and Clinical Trials and Drug Therapy and Amyotrophic Lateral Sclerosis and Patient Safety","Elsevier Science","1474-4422 and 1730-6167","208-216","Background: Neurite outgrowth inhibitor A (Nogo-A) is thought to have a role in the pathophysiology of amyotrophic lateral sclerosis (ALS). A monoclonal antibody against Nogo-A showed a positive effect in the SOD1G93A mouse model of ALS, and a humanised form of this antibody (ozanezumab) was well tolerated in a first-in-human trial. Therefore, we aimed to assess the safety and efficacy of ozanezumab in patients with ALS. Methods: This randomised, double-blind, placebo-controlled, phase 2 trial was done in 34 centres in 11 countries. Patients aged 1880 years with a diagnosis of familial or sporadic ALS were randomly assigned (1:1), centrally according to a computer-generated allocation schedule, to receive ozanezumab (15 mg/kg) or placebo as intravenous infusions over 1 h every 2 weeks for 46 weeks, followed by assessments at week 48 and week 60. Patients and study personnel were masked to treatment assignment. The primary outcome was a joint-rank analysis of function (ALS Functional Rating Scale-Revised) and overall survival, analysed at 48 weeks in all patients who received at least one dose of study drug. This study is registered with ClinicalTrials.gov, number NCT01753076, and with GSK-ClinicalStudyRegister.com, NOG112264, and is completed. Findings: Between Dec 20, 2012, and Nov 1, 2013, we recruited 307 patients, of whom 303 were randomly assigned to receive placebo (n = 151) or ozanezumab (n = 152). The adjusted mean of the joint-rank score was 149 (SE 135) for the ozanezumab group and 150 (136) for the placebo group, with a least squares mean difference of 300 (95% CI 679 to 79; p = 012). Overall, reported adverse events, serious adverse events, and adverse events leading to permanent discontinuation of study drug or withdrawal from study were similar between the treatment groups, except for dyspepsia (ten [7%] in the ozanezumab group vs four [3%] in the placebo group), depression (11 [7%] vs five [3%]), and diarrhoea (25 [16%] vs 12 [8%]). Respiratory failure was the most common serious adverse event (12 [8%] vs seven [5%]). At week 60, the number of deaths was higher in the ozanezumab group (20 [13%]) than in the placebo group (16 [11%]), mainly as a result of respiratory failure (ten [7%] vs five [3%]). Two deaths were considered related to the study drug (bladder transitional cell carcinoma in the ozanezumab group and cerebrovascular accident in the placebo group). Interpretation: Ozanezumab did not show efficacy compared with placebo in patients with ALS. Therefore, Nogo-A does not seem to be an effective therapeutic target in ALS. (PsycINFO Database Record (c) 2017 APA, all rights reserved)","Lavrov, Arseniy, Neurosciences Therapy Area Unit, GlaxoSmithKline, Stockley Park West, Uxbridge, MDX, United Kingdom, UB11 1BT","Sponsor: GlaxoSmithKline. Recipients: No recipient indicated","10.1016/S1474-4422(16)30399-4",NA,"http://search.ebscohost.com/login.aspx?direct=true&AuthType=ip,uid&db=psyh&AN=2017-08653-022&site=ehost-live&scope=site and arseniy.j.lavrov@gsk.com","The Lancet Neurology",NA,"psyh",NA,"EBSCOhost","2017-08653-022","Accession Number: 2017-08653-022. Partial author list: First Author & Affiliation: Meininger, Vincent; Ramsay Generale de Sante Hopital Prive Peupliers, Paris, France. Institutional Authors: NOG112264 Study Group. Release Date: 20170313. Publication Type: Journal (0100), Peer Reviewed Journal (0110). Format Covered: Electronic. Document Type: Journal Article. Language: English. Major Descriptor: Clinical Trials; Drug Therapy; Amyotrophic Lateral Sclerosis; Patient Safety. Classification: Neurological Disorders & Brain Damage (3297); Medical Treatment of Physical Illness (3363). Population: Human (10); Male (30); Female (40). Location: Australia; Belgium; Canada; France; Germany; Italy; Japan; United Kingdom; Republic of Korea; Netherlands; US. Age Group: Adulthood (18 yrs & older) (300); Young Adulthood (18-29 yrs) (320); Thirties (30-39 yrs) (340); Middle Age (40-64 yrs) (360); Aged (65 yrs & older) (380). Tests & Measures: ALS Functional Rating Scale-Revised; EuroQol-Short Form 5-Level Version; Columbia-Suicide Severity Rating Scale DOI: 10.1037/t52667-000; Clinical Global Impression Scale. Methodology: Clinical Trial; Empirical Study; Quantitative Study. Page Count: 9. Issue Publication Date: Mar, 2017. Publication History: First Posted Date: Jan 27, 2017.",NA,NA,"Problem sets/PS 2/PsycINFO.ris",1,"excluded",""
"Ioverno_2016_PsySexOriGenDiv","JOUR","2016-59420-003","The protective role of gaystraight alliances for lesbian, gay, bisexual, and questioning students: A prospective analysis","Ioverno, Salvatore and Belser, Alexander B. and Baiocco, Roberto and Grossman, Arnold H. and Russell, Stephen T.","2016","Psychol Sex Orientat Gend Divers","3","4","bullying and depression and self-esteem and gaystraight alliance and school safety and High Schools and Homosexuality and Protective Factors and Safety and Bullying and Bisexuality and Heterosexuality and High School Students and Lesbianism and Major Depression and Male Homosexuality and Risk Factors and Self-Esteem and School Safety","Educational Publishing Foundation","2329-0382 and 2329-0390","397-406","Prior studies show a strong association between gaystraight alliances (GSAs) and the well-being and safety of sexual minority students at school. However, nearly all existing literature has relied on cross-sectional data. Using data from the first 2 panels of a multisite longitudinal study on risk and protective factors for suicide among lesbian, gay, bisexual, and questioning (LGBQ) youth in 3 U.S. cities, we examined the influence of presence of and participation in a GSA on perceptions of safety at school, homophobic bullying experiences, and psychosocial adjustment (depression and self-esteem) in 327 LGBQ students across 2 school years. LGBQ students who had GSAs in their schools or were members of GSAs in the prior year showed no differences in psychological adjustment, but they reported perceptions of more school safety and less homophobic bullying in the following school year. Further, changes in GSA presence (gaining a GSA) and changes in participation (from nonparticipation to participation) were independently associated with stronger perceived safety in the subsequent school year. This study provides the first prospective evidence of the lasting positive role of GSAs for high school students, and documents that changes in GSA presence and participation are associated with safety at school. Education policy and practice implications are discussed. (PsycINFO Database Record (c) 2019 APA, all rights reserved)","Russell, Stephen T., Department of Human Development and Family Sciences, University of Texas at Austin, 108 East Dean Keeton Street, Stop A2702, Austin, TX, US, 78701","Sponsor: National Institute of Mental Health, US. Grant: R01MH091212. Recipients: No recipient indicated and Sponsor: Eunice Kennedy Shriver National Institute of Child Health and Human Development, US. Grant: R24HD042849. Other Details: grant awarded to the University of Texas at Austin, Population Research Center. Recipients: No recipient indicated","10.1037/sgd0000193",NA,"http://search.ebscohost.com/login.aspx?direct=true&AuthType=ip,uid&db=psyh&AN=2016-59420-003&site=ehost-live&scope=site and ORCID: 0000-0002-6238-0606 and stephen.russell@utexas.edu","Advances in Research With LGBTQ Youth in Schools; Psychology of Sexual Orientation and Gender Diversity",NA,"psyh",NA,"EBSCOhost","2016-59420-003","Accession Number: 2016-59420-003. PMID: 28042585 Partial author list: First Author & Affiliation: Ioverno, Salvatore; Department of Clinical and Dynamic Psychology, Sapienza University, Rome, Italy. Release Date: 20161212. Correction Date: 20190211. Publication Type: Journal (0100), Peer Reviewed Journal (0110). Format Covered: Electronic. Document Type: Journal Article. Language: English. Major Descriptor: High Schools; Homosexuality; Protective Factors; Safety; Bullying. Minor Descriptor: Bisexuality; Heterosexuality; High School Students; Lesbianism; Major Depression; Male Homosexuality; Risk Factors; Self-Esteem; School Safety. Classification: Sexual Behavior & Sexual Orientation (2980); Educational Psychology (3500). Population: Human (10); Male (30); Female (40). Location: US. Age Group: Adolescence (13-17 yrs) (200). Tests & Measures: Beck Depression InventoryYouth; Rosenberg Self-Esteem Scale DOI: 10.1037/t01038-000. Methodology: Empirical Study; Longitudinal Study; Prospective Study; Quantitative Study. Page Count: 10. Issue Publication Date: Dec, 2016. Publication History: Accepted Date: Jul 6, 2016; Revised Date: Jul 5, 2016; First Submitted Date: Mar 2, 2016. Copyright Statement: American Psychological Association. 2016.",NA,NA,"Problem sets/PS 2/PsycINFO.ris",1,"excluded",""
"Lyons_2014_DiAbInSeA.HuanSoSc","THES","2014-99171-204","Perceptions of cyberbullying management within southern California independent middle schools: A multiple case study","Lyons, Suzanne Shaw","2014","Dissertation Abstracts International Section A: Humanities and Social Sciences","75","3-A(E)","school leaders and multiple case study and adolescent victims and commit suicide and instant messaging and Communities and Internet and School Based Intervention and Middle Schools and Bullying and Websites","ProQuest Information & Learning","0419-4209 and 978-1-303-54251-0",NA,"Cyberbullying among students has become a serious issue for school communities, partly due to ubiquitous Internet access, instant messaging, and a myriad of social media websites that provide infinite ways to abuse, threaten, and insult others. In some cases, students have been cyberbullied so brutally that adolescent victims even contemplate or commit suicide. The central focus of this research study was to describe how school leaders are effectively managing and reducing the number of cyberbullying incidents. The researcher implemented a qualitative multiple case study design and interviewed teachers, parents, and administrators at three independent middle schools in southern California. Findings revealed that school leaders take immediate action to resolve incidents, but that their ability to consistently monitor student online communication is exceedingly difficult. Since victims can experience continued repercussions even after an incident has been addressed, more follow-through with victims and perpetrators is needed as well as uncovering the root cause of incidents to more effectively resolve situations. Furthermore, school intervention that is well intentioned can sometimes perpetuate or act as a catalyst for repercussions on the victims, and parent responses and involvement can sometimes impede successful management by school leaders. (PsycINFO Database Record (c) 2016 APA, all rights reserved)",NA,NA,NA,NA,"http://search.ebscohost.com/login.aspx?direct=true&AuthType=ip,uid&db=psyh&AN=2014-99171-204&site=ehost-live&scope=site",NA,NA,"psyh",NA,"EBSCOhost","2014-99171-204","Accession Number: 2014-99171-204. Other Journal Title: Dissertation Abstracts International. Partial author list: First Author & Affiliation: Lyons, Suzanne Shaw; California Lutheran U., US. Release Date: 20141013. Publication Type: Dissertation Abstract (0400). Format Covered: Electronic. Document Type: Dissertation. Dissertation Number: AAI3602344. ISBN: 978-1-303-54251-0. Language: English. Major Descriptor: Communities; Internet; School Based Intervention. Minor Descriptor: Middle Schools; Bullying; Websites. Classification: Educational Psychology (3500). Population: Human (10). Location: US. Methodology: Empirical Study; Interview; Quantitative Study.",NA,NA,"Problem sets/PS 2/PsycINFO.ris",1,"selected",""
"Logis_2015_YousuiandbulChaandstrforpreandint","CHAP","2014-22830-016","Bullying, rejection, and isolation: Lessons learned from classroom peer ecology studies","Logis, Handrea Anita and Rodkin, Philip C.","2015","Youth suicide and bullying: Challenges and strategies for prevention and intervention",NA,NA,"bullying and rejection and isolation and classroom peer ecology and suicide and suicide prevention and peer relationships and self-destructive behavior and Classrooms and Peer Relations and Social Acceptance and Suicide and Bullying and Ecology and Self-Injurious Behavior and Social Isolation and Suicide Prevention","Oxford University Press","978-0-19-995070-6","191-202","Tragic stories of adolescent suicide due to alleged bullying have changed views on bullying from regarding it as a harmless rite of passage to seeing it as a serious public heath concern. Most schools have been implementing anti-bullying prevention and intervention programs. Nevertheless, the issue of bullying and suicide persists. A meta-analysis found that school-based anti-bullying programs resulted, in a positive and statistically significant effect in reducing bullying, but the overall effect size was small and did not meet the threshold for practical significance. Another meta-analysis found that school-based anti-bullying programs resulted in changes in students' attitudes, perceptions, and knowledge of bullying, but not in their behaviors. When considering suicide prevention, most studies could not identify a critical ingredient in their school-based programs that leads to successful outcomes. One study found that children's reports of suicidal behaviors and depression tended to decrease, but their helping and coping strategies did not improve. Although students' levels of suicide attempts went down after participating in a school based psycho-educational program, their reports of suicidal ideation remained stable. One of the possible explanations for the ineffectiveness of many anti-bullying programs in North America is the failure to intervene at the environmental level. Similarly, in terms of suicide prevention programs, there is lack of evidence that purely educational approaches can effectively lead depressed and suicidal youth to seek professional help. Drawing from studies focusing on peer social ecologies and youth outcomes, this chapter considers elements of classroom environments that promote healthy peer relationships, which may eventually help reduce bullying and suicidal behaviors. We begin with theories of suicide to uncover specific aspects of bullying that may trigger self-destructive behaviors among youth. We then turn to empirical studies that focus on the association between bullying and suicide, and the effect of classroom structures and teaching practices on bullying and rejection. We provide directions for future research to promote healthier classroom environments for youth. We conclude the chapter with the suggestion that improving youths' feelings of belonging can be among the ways adults can reduce bullying and suicidal behaviors among children and adolescents. (PsycInfo Database Record (c) 2020 APA, all rights reserved)",NA,NA,NA,"New York, NY","http://search.ebscohost.com/login.aspx?direct=true&AuthType=ip,uid&db=psyh&AN=2014-22830-016&site=ehost-live&scope=site",NA,"Goldblum, Peter and Espelage, Dorothy L. and Chu, Joyce and Bongar, Bruce","psyh","Goldblum, Peter and Espelage, Dorothy L. and Chu, Joyce and Bongar, Bruce","EBSCOhost","2014-22830-016","Accession Number: 2014-22830-016. Partial author list: First Author & Affiliation: Logis, Handrea Anita; University of Illinois at Urbana-Champaign, Champaign, IL, US. Release Date: 20151005. Correction Date: 20200713. Publication Type: Book (0200), Edited Book (0280). Format Covered: Print. Document Type: Chapter. ISBN: 978-0-19-995070-6, Hardcover. Language: English. Major Descriptor: Classrooms; Peer Relations; Social Acceptance; Suicide; Bullying. Minor Descriptor: Ecology; Self-Injurious Behavior; Social Isolation; Suicide Prevention. Classification: Behavior Disorders & Antisocial Behavior (3230). Population: Human (10). Intended Audience: Psychology: Professional & Research (PS). Tests & Measures: Beck Hopelessness Scale. References Available: Y. Page Count: 12.",NA,NA,"Problem sets/PS 2/PsycINFO.ris",1,"selected",""
